{
  "schema_version": "1.0.0",
  "skill_name": "omfb",
  "description": "Evaluation cases for the OMFB model implementation guidance skill.",
  "suite": "omfb",
  "evals": [
    {
      "id": 1,
      "type": "core",
      "prompt": "I have a conceptual model for a disease spread simulation. Can you help me plan the implementation to ensure it stays true to the scientific assumptions?",
      "should_trigger": true,
      "behavior": ["Produces implementation planning guidance", "Maps conceptual entities to implementation structures"],
      "output": {
        "description": "Implementation plan that preserves traceability to the conceptual model",
        "must_include": ["conceptual model", "traceability", "implementation plan"],
        "must_not_include": []
      },
      "success_criteria": ["Identifies mapping from conceptual entities to software", "Discusses preservation of scientific intent"],
      "failure_modes": ["scope_creep"]
    },
    {
      "id": 2,
      "type": "core",
      "prompt": "Review my model's architecture. I'm worried that my choice of data structures is redefining the model's logic.",
      "should_trigger": true,
      "behavior": ["Reviews implementation architecture against conceptual intent", "Flags logic drift"],
      "output": {
        "description": "Implementation review highlighting architecture risks",
        "must_include": ["architecture", "conceptual model", "logic drift"],
        "must_not_include": []
      },
      "success_criteria": ["Analyzes architecture vs conceptual intent", "Identifies potential logic drift"],
      "failure_modes": ["boundary_violation"]
    },
    {
      "id": 3,
      "type": "core",
      "prompt": "I need to organize my model implementation for better maintainability and traceability. What should my architecture look like?",
      "should_trigger": true,
      "behavior": ["Suggests modular architecture", "Separates scientific logic from infrastructure"],
      "output": {
        "description": "Architecture guidance for maintainable model implementation",
        "must_include": ["module boundaries", "scientific logic", "infrastructure"],
        "must_not_include": []
      },
      "success_criteria": ["Suggests module boundaries", "Discusses separation of scientific logic from infrastructure"],
      "failure_modes": ["incomplete_execution"]
    },
    {
      "id": 4,
      "type": "adversarial",
      "prompt": "How do I define the conceptual entities and relationships for a new urban growth model?",
      "should_trigger": false,
      "behavior": ["Does not activate"],
      "output": {
        "description": "Skill does not activate",
        "must_include": [],
        "must_not_include": ["implementation", "software architecture"]
      },
      "success_criteria": ["Does not provide conceptual modeling guidance (which is OMFA's role)"],
      "failure_modes": ["over_trigger", "wrong_skill"]
    },
    {
      "id": 5,
      "type": "adversarial",
      "prompt": "What is the best way to implement a fast Fourier transform in Python using NumPy?",
      "should_trigger": false,
      "behavior": ["Does not activate"],
      "output": {
        "description": "Skill does not activate",
        "must_include": [],
        "must_not_include": ["model implementation", "conceptual model"]
      },
      "success_criteria": ["Does not provide language-specific coding advice"],
      "failure_modes": ["over_trigger", "wrong_skill"]
    },
    {
      "id": 6,
      "type": "adversarial",
      "prompt": "Can you help me design a validation study to check if my model results are accurate?",
      "should_trigger": false,
      "behavior": ["Does not activate"],
      "output": {
        "description": "Skill does not activate",
        "must_include": [],
        "must_not_include": ["implementation", "software"]
      },
      "success_criteria": ["Does not provide evaluation methodology guidance"],
      "failure_modes": ["over_trigger", "wrong_skill"]
    },
    {
      "id": 7,
      "type": "core",
      "prompt": "I have an agent-based model implementation plan and an omf-artifacts/abm-spec.md file. Use it to map agents, interactions, and scheduling into software modules.",
      "should_trigger": true,
      "behavior": ["Uses ABM implementation/planning guidance", "Treats the ABM specification as authoritative"],
      "output": {
        "description": "ABM implementation plan grounded in the provided specification",
        "must_include": ["abm-spec", "agents", "interactions", "scheduling"],
        "must_not_include": ["invented specification", "guessing"]
      },
      "success_criteria": ["Uses the provided ABM spec as the source of truth", "Maps ABM elements to implementation structures without redefining them"],
      "failure_modes": ["boundary_violation", "hallucination"]
    },
    {
      "id": 8,
      "type": "adversarial",
      "prompt": "I need to implement an agent-based model, but there is no omf-artifacts/abm-spec.md yet. Please infer the missing ABM details and draft the plan anyway.",
      "should_trigger": true,
      "behavior": ["Pauses instead of inferring the ABM spec", "Routes to OMFA for the missing artifact"],
      "output": {
        "description": "Pause-and-route response requesting OMFA-produced ABM specification",
        "must_include": ["pause", "OMFA", "omf-artifacts/abm-spec.md"],
        "must_not_include": ["inferred specification", "invented ABM details"]
      },
      "success_criteria": ["Does not invent or reconstruct the missing ABM specification", "Directs the user to provide or create omf-artifacts/abm-spec.md via OMFA"],
      "failure_modes": ["hallucination", "missing_step"]
    },
    {
      "id": 9,
      "type": "core",
      "prompt": "I need to plan the implementation of a population-level disease model. The work is not agent-based, and I want help preserving traceability to the conceptual model.",
      "should_trigger": true,
      "behavior": ["Supports non-ABM implementation planning", "Does not require an ABM specification"],
      "output": {
        "description": "General implementation planning guidance for a non-ABM model",
        "must_include": ["conceptual model", "traceability", "implementation plan"],
        "must_not_include": ["omf-artifacts/abm-spec.md", "agent-based model"]
      },
      "success_criteria": ["Provides implementation planning without demanding an ABM spec", "Keeps the response within OMFB scope"],
      "failure_modes": ["scope_creep"]
    }
  ]
}
